{
  "$schema": "../../schema/scene.schema.json",
  "schemaVersion": 4,
  "id": "the-lodger",
  "name": "The Lodger",
  "clips": [
    {
      "id": "clip-1",
      "label": "Newsroom window",
      "file": "../../assets/scenes/the-lodger/clip-1.mp4",
      "durationSeconds": 8,
      "startSeconds": 0,
      "subjectFocus": {
        "x": 0.509,
        "y": 0.535
      }
    },
    {
      "id": "clip-2",
      "label": "Dancers recoil",
      "file": "../../assets/scenes/the-lodger/clip-2.mp4",
      "durationSeconds": 8,
      "startSeconds": 0.5,
      "subjectFocus": {
        "x": 0.483,
        "y": 0.563
      }
    },
    {
      "id": "clip-3",
      "label": "Staircase vigil",
      "file": "../../assets/scenes/the-lodger/clip-3.mp4",
      "durationSeconds": 8,
      "startSeconds": 1,
      "subjectFocus": {
        "x": 0.404,
        "y": 0.3
      }
    },
    {
      "id": "clip-4",
      "label": "Clock tower",
      "file": "../../assets/scenes/the-lodger/clip-4.mp4",
      "durationSeconds": 8,
      "startSeconds": 1.5,
      "subjectFocus": {
        "x": 0.522,
        "y": 0.351
      }
    },
    {
      "id": "clip-5",
      "label": "Restless sleep",
      "file": "../../assets/scenes/the-lodger/clip-5.mp4",
      "durationSeconds": 8,
      "startSeconds": 0,
      "subjectFocus": {
        "x": 0.584,
        "y": 0.438
      }
    },
    {
      "id": "clip-6",
      "label": "Landing encounter",
      "file": "../../assets/scenes/the-lodger/clip-6.mp4",
      "durationSeconds": 8,
      "startSeconds": 0.5,
      "subjectFocus": {
        "x": 0.496,
        "y": 0.305
      }
    },
    {
      "id": "clip-7",
      "label": "Police conference",
      "file": "../../assets/scenes/the-lodger/clip-7.mp4",
      "durationSeconds": 8,
      "startSeconds": 1,
      "subjectFocus": {
        "x": 0.657,
        "y": 0.306
      }
    },
    {
      "id": "clip-8",
      "label": "Tense close-up",
      "file": "../../assets/scenes/the-lodger/clip-8.mp4",
      "durationSeconds": 8,
      "startSeconds": 1.5,
      "subjectFocus": {
        "x": 0.468,
        "y": 0.469
      }
    },
    {
      "id": "clip-9",
      "label": "Landlady at the door",
      "file": "../../assets/scenes/the-lodger/clip-9.mp4",
      "durationSeconds": 8,
      "startSeconds": 0,
      "subjectFocus": {
        "x": 0.711,
        "y": 0.26
      }
    },
    {
      "id": "clip-10",
      "label": "Drawing-room vigil",
      "file": "../../assets/scenes/the-lodger/clip-10.mp4",
      "durationSeconds": 8,
      "startSeconds": 0.5,
      "subjectFocus": {
        "x": 0.432,
        "y": 0.207
      }
    },
    {
      "id": "clip-11",
      "label": "Portrait and chandelier",
      "file": "../../assets/scenes/the-lodger/clip-11.mp4",
      "durationSeconds": 8,
      "startSeconds": 1,
      "subjectFocus": {
        "x": 0.504,
        "y": 0.369
      }
    },
    {
      "id": "clip-12",
      "label": "Night pursuit",
      "file": "../../assets/scenes/the-lodger/clip-12.mp4",
      "durationSeconds": 8,
      "startSeconds": 1.5,
      "subjectFocus": {
        "x": 0.452,
        "y": 0.351
      }
    }
  ],
  "visualLoops": [
    {
      "id": "song-default",
      "name": "Default · Clip 1",
      "length": {
        "bars": 1
      },
      "repeat": true,
      "events": [
        {
          "id": "song-default-clip-1",
          "at": {
            "bars": 0
          },
          "duration": {
            "bars": 1
          },
          "clipId": "clip-1",
          "source": {
            "startSeconds": 0,
            "loop": true,
            "rate": 1
          },
          "appearance": {
            "z": 0,
            "opacity": 1,
            "blendMode": "normal",
            "fit": "contain",
            "filters": []
          }
        }
      ]
    },
    {
      "id": "cue-a-loop",
      "name": "Cue A · Call/response",
      "length": {
        "bars": 2
      },
      "repeat": true,
      "events": [
        {
          "id": "cue-a-loop-a",
          "at": {
            "beats": 0
          },
          "duration": {
            "beats": 7
          },
          "clipId": "clip-8",
          "source": {
            "startSeconds": 1.5,
            "loop": true,
            "rate": 1
          },
          "appearance": {
            "z": 0,
            "opacity": 1,
            "blendMode": "normal",
            "fit": "contain",
            "filters": []
          }
        },
        {
          "id": "cue-a-loop-b",
          "at": {
            "beats": 7
          },
          "duration": {
            "beats": 1
          },
          "clipId": "clip-9",
          "source": {
            "startSeconds": 0,
            "loop": true,
            "rate": 1
          },
          "appearance": {
            "z": 0,
            "opacity": 1,
            "blendMode": "normal",
            "fit": "contain",
            "filters": []
          }
        }
      ]
    },
    {
      "id": "cue-b-loop",
      "name": "Cue B · Crossfade",
      "length": {
        "bars": 3
      },
      "repeat": true,
      "events": [
        {
          "id": "cue-b-loop-a",
          "at": {
            "beats": 0
          },
          "duration": {
            "beats": 12
          },
          "clipId": "clip-10",
          "source": {
            "startSeconds": 0.5,
            "loop": true,
            "rate": 1
          },
          "appearance": {
            "z": 0,
            "opacity": 1,
            "blendMode": "plus-lighter",
            "fit": "contain",
            "filters": [],
            "opacityEnvelope": {
              "from": 1,
              "to": 0,
              "curve": "linear"
            },
            "motion": {
              "type": "ken-burns",
              "focusSource": "clip-subject",
              "progress": "loop",
              "easing": "ease-in-out",
              "start": {
                "scale": 1,
                "focus": {
                  "x": 0.5,
                  "y": 0.5
                }
              },
              "end": {
                "scale": 1.1600000000000001,
                "focus": {
                  "x": 0.432,
                  "y": 0.207
                }
              }
            }
          }
        },
        {
          "id": "cue-b-loop-b",
          "at": {
            "beats": 0
          },
          "duration": {
            "beats": 12
          },
          "clipId": "clip-11",
          "source": {
            "startSeconds": 1,
            "loop": true,
            "rate": 1
          },
          "appearance": {
            "z": 1,
            "opacity": 1,
            "blendMode": "plus-lighter",
            "fit": "contain",
            "filters": [],
            "opacityEnvelope": {
              "from": 0,
              "to": 1,
              "curve": "linear"
            }
          }
        }
      ]
    },
    {
      "id": "cue-c-loop",
      "name": "Cue C · Sequence",
      "length": {
        "bars": 4
      },
      "repeat": true,
      "events": [
        {
          "id": "cue-c-loop-a",
          "at": {
            "beats": 0
          },
          "duration": {
            "beats": 8
          },
          "clipId": "clip-12",
          "source": {
            "startSeconds": 1.5,
            "loop": true,
            "rate": 1
          },
          "appearance": {
            "z": 0,
            "opacity": 1,
            "blendMode": "normal",
            "fit": "contain",
            "filters": []
          }
        },
        {
          "id": "cue-c-loop-b",
          "at": {
            "beats": 8
          },
          "duration": {
            "beats": 8
          },
          "clipId": "clip-2",
          "source": {
            "startSeconds": 0.5,
            "loop": true,
            "rate": 1
          },
          "appearance": {
            "z": 0,
            "opacity": 1,
            "blendMode": "normal",
            "fit": "contain",
            "filters": []
          }
        }
      ]
    },
    {
      "id": "cue-d-loop",
      "name": "Cue D · Alternate",
      "length": {
        "bars": 1
      },
      "repeat": true,
      "events": [
        {
          "id": "cue-d-loop-a-1",
          "at": {
            "beats": 0
          },
          "duration": {
            "beats": 1
          },
          "clipId": "clip-3",
          "source": {
            "startSeconds": 1,
            "loop": true,
            "rate": 1
          },
          "appearance": {
            "z": 0,
            "opacity": 1,
            "blendMode": "normal",
            "fit": "contain",
            "filters": []
          }
        },
        {
          "id": "cue-d-loop-b-2",
          "at": {
            "beats": 1
          },
          "duration": {
            "beats": 1
          },
          "clipId": "clip-4",
          "source": {
            "startSeconds": 1.5,
            "loop": true,
            "rate": 1
          },
          "appearance": {
            "z": 0,
            "opacity": 1,
            "blendMode": "normal",
            "fit": "contain",
            "filters": []
          }
        },
        {
          "id": "cue-d-loop-a-3",
          "at": {
            "beats": 2
          },
          "duration": {
            "beats": 1
          },
          "clipId": "clip-3",
          "source": {
            "startSeconds": 1,
            "loop": true,
            "rate": 1
          },
          "appearance": {
            "z": 0,
            "opacity": 1,
            "blendMode": "normal",
            "fit": "contain",
            "filters": []
          }
        },
        {
          "id": "cue-d-loop-b-4",
          "at": {
            "beats": 3
          },
          "duration": {
            "beats": 1
          },
          "clipId": "clip-4",
          "source": {
            "startSeconds": 1.5,
            "loop": true,